No.     Time        Source                Destination           Protocol Length Real Time Messaging Protocol Info
   4055 17.663346   156.35.162.1          192.168.0.98          RTMP     1514   Yes                          macromedia-fcs > fjdocdist [ACK] Seq=170983 Ack=458 Win=14600 Len=1460 | Aggregate

Frame 4055: 1514 bytes on wire (12112 bits), 1514 bytes captured (12112 bits)
Ethernet II, Src: Dell_87:49:2e (00:26:b9:87:49:2e), Dst: Dell_aa:08:96 (00:15:c5:aa:08:96)
Internet Protocol Version 4, Src: 156.35.162.1 (156.35.162.1), Dst: 192.168.0.98 (192.168.0.98)
Transmission Control Protocol, Src Port: macromedia-fcs (1935), Dst Port: fjdocdist (1848), Seq: 170983, Ack: 458, Len: 1460
Real Time Messaging Protocol (Aggregate)
    RTMP Header
    RTMP Body
        Audio Tag
            Type: Audio Tag (8)
            Data size: 315
            Timestamp: 26
            Timestamp Extended: 0
            Stream ID: 0
            Data
            Previous tag size: 326
        Audio Tag
            Type: Audio Tag (8)
            Data size: 315
            Timestamp: 52
            Timestamp Extended: 0
            Stream ID: 0
            Data
            Previous tag size: 326
        Audio Tag
            Type: Audio Tag (8)
            Data size: 315
            Timestamp: 78
            Timestamp Extended: 0
            Stream ID: 0
            Data
            Previous tag size: 326
        Audio Tag
            Type: Audio Tag (8)
            Data size: 315
            Timestamp: 104
            Timestamp Extended: 0
            Stream ID: 0
            Data
            Previous tag size: 326
        Audio Tag
            Type: Audio Tag (8)
            Data size: 315
            Timestamp: 130
            Timestamp Extended: 0
            Stream ID: 0
            Data
            Previous tag size: 326
        Audio Tag
            Type: Audio Tag (8)
            Data size: 315
            Timestamp: 156
            Timestamp Extended: 0
            Stream ID: 0
            Data
            Previous tag size: 326
        Audio Tag
            Type: Audio Tag (8)
            Data size: 315
            Timestamp: 182
            Timestamp Extended: 0
            Stream ID: 0
            Data
            Previous tag size: 326
        Audio Tag
            Type: Audio Tag (8)
            Data size: 315
            Timestamp: 208
            Timestamp Extended: 0
            Stream ID: 0
            Data
            Previous tag size: 326
        Video Tag
            Type: Video Tag (9)
            Data size: 25737
            Timestamp: 216
            Timestamp Extended: 0
            Stream ID: 0
            Data
            Previous tag size: 25748
        Audio Tag
            Type: Audio Tag (8)
            Data size: 315
            Timestamp: 235
            Timestamp Extended: 0
            Stream ID: 0
            Data
            Previous tag size: 326
        Video Tag
            Type: Video Tag (9)
            Data size: 1771
            Timestamp: 249
            Timestamp Extended: 0
            Stream ID: 0
            Data
            Previous tag size: 1782
        Audio Tag
            Type: Audio Tag (8)
            Data size: 315
            Timestamp: 261
            Timestamp Extended: 0
            Stream ID: 0
            Data
            Previous tag size: 326
        Audio Tag
            Type: Audio Tag (8)
            Data size: 315
            Timestamp: 287
            Timestamp Extended: 0
            Stream ID: 0
            Data
            Previous tag size: 326
        Audio Tag
            Type: Audio Tag (8)
            Data size: 315
            Timestamp: 313
            Timestamp Extended: 0
            Stream ID: 0
            Data
            Previous tag size: 326
        Audio Tag
            Type: Audio Tag (8)
            Data size: 315
            Timestamp: 339
            Timestamp Extended: 0
            Stream ID: 0
            Data
            Previous tag size: 326
        Video Tag
            Type: Video Tag (9)
            Data size: 1464
            Timestamp: 349
            Timestamp Extended: 0
            Stream ID: 0
            Data
            Previous tag size: 1475
        Audio Tag
            Type: Audio Tag (8)
            Data size: 315
            Timestamp: 365
            Timestamp Extended: 0
            Stream ID: 0
            Data
            Previous tag size: 326
        Video Tag
            Type: Video Tag (9)
            Data size: 1286
            Timestamp: 383
            Timestamp Extended: 0
            Stream ID: 0
            Data
            Previous tag size: 1297
        Audio Tag
            Type: Audio Tag (8)
            Data size: 315
            Timestamp: 391
            Timestamp Extended: 0
            Stream ID: 0
            Data
            Previous tag size: 326
        Video Tag
            Type: Video Tag (9)
            Data size: 1198
            Timestamp: 416
            Timestamp Extended: 0
            Stream ID: 0
            Data
            Previous tag size: 1209
        Audio Tag
            Type: Audio Tag (8)
            Data size: 315
            Timestamp: 417
            Timestamp Extended: 0
            Stream ID: 0
            Data
            Previous tag size: 326
        Audio Tag
            Type: Audio Tag (8)
            Data size: 315
            Timestamp: 444
            Timestamp Extended: 0
            Stream ID: 0
            Data
            Previous tag size: 326
        Video Tag
            Type: Video Tag (9)
            Data size: 1738
            Timestamp: 449
            Timestamp Extended: 0
            Stream ID: 0
            Data
            Previous tag size: 1749
        Audio Tag
            Type: Audio Tag (8)
            Data size: 315
            Timestamp: 470
            Timestamp Extended: 0
            Stream ID: 0
            Data
            Previous tag size: 326
        Video Tag
            Type: Video Tag (9)
            Data size: 1335
            Timestamp: 483
            Timestamp Extended: 0
            Stream ID: 0
            Data
            Previous tag size: 1346
        Audio Tag
            Type: Audio Tag (8)
            Data size: 315
            Timestamp: 496
            Timestamp Extended: 0
            Stream ID: 0
            Data
            Previous tag size: 326
        Video Tag
            Type: Video Tag (9)
            Data size: 1593
            Timestamp: 516
            Timestamp Extended: 0
            Stream ID: 0
            Data
            Previous tag size: 1604
        Audio Tag
            Type: Audio Tag (8)
            Data size: 315
            Timestamp: 522
            Timestamp Extended: 0
            Stream ID: 0
            Data
            Previous tag size: 326
        Audio Tag
            Type: Audio Tag (8)
            Data size: 315
            Timestamp: 548
            Timestamp Extended: 0
            Stream ID: 0
            Data
            Previous tag size: 326
        Video Tag
            Type: Video Tag (9)
            Data size: 8097
            Timestamp: 550
            Timestamp Extended: 0
            Stream ID: 0
            Data
            Previous tag size: 8108
        Audio Tag
            Type: Audio Tag (8)
            Data size: 315
            Timestamp: 574
            Timestamp Extended: 0
            Stream ID: 0
            Data
            Previous tag size: 326
        Video Tag
            Type: Video Tag (9)
            Data size: 631
            Timestamp: 583
            Timestamp Extended: 0
            Stream ID: 0
            Data
            Previous tag size: 642
        Audio Tag
            Type: Audio Tag (8)
            Data size: 315
            Timestamp: 600
            Timestamp Extended: 0
            Stream ID: 0
            Data
            Previous tag size: 326
        Video Tag
            Type: Video Tag (9)
            Data size: 614
            Timestamp: 616
            Timestamp Extended: 0
            Stream ID: 0
            Data
            Previous tag size: 625
        Audio Tag
            Type: Audio Tag (8)
            Data size: 315
            Timestamp: 626
            Timestamp Extended: 0
            Stream ID: 0
            Data
            Previous tag size: 326
        Video Tag
            Type: Video Tag (9)
            Data size: 635
            Timestamp: 650
            Timestamp Extended: 0
            Stream ID: 0
            Data
            Previous tag size: 646
        Audio Tag
            Type: Audio Tag (8)
            Data size: 315
            Timestamp: 653
            Timestamp Extended: 0
            Stream ID: 0
            Data
            Previous tag size: 326
        Audio Tag
            Type: Audio Tag (8)
            Data size: 315
            Timestamp: 679
            Timestamp Extended: 0
            Stream ID: 0
            Data
            Previous tag size: 326
        Video Tag
            Type: Video Tag (9)
            Data size: 663
            Timestamp: 683
            Timestamp Extended: 0
            Stream ID: 0
            Data
            Previous tag size: 674
        Audio Tag
            Type: Audio Tag (8)
            Data size: 315
            Timestamp: 705
            Timestamp Extended: 0
            Stream ID: 0
            Data
            Previous tag size: 326
        Video Tag
            Type: Video Tag (9)
            Data size: 703
            Timestamp: 716
            Timestamp Extended: 0
            Stream ID: 0
            Data
            Previous tag size: 714
        Audio Tag
            Type: Audio Tag (8)
            Data size: 315
            Timestamp: 731
            Timestamp Extended: 0
            Stream ID: 0
            Data
            Previous tag size: 326
        Video Tag
            Type: Video Tag (9)
            Data size: 796
            Timestamp: 750
            Timestamp Extended: 0
            Stream ID: 0
            Data
            Previous tag size: 807
        Audio Tag
            Type: Audio Tag (8)
            Data size: 315
            Timestamp: 757
            Timestamp Extended: 0
            Stream ID: 0
            Data
            Previous tag size: 326
        Audio Tag
            Type: Audio Tag (8)
            Data size: 315
            Timestamp: 783
            Timestamp Extended: 0
            Stream ID: 0
            Data
            Previous tag size: 326
        Video Tag
            Type: Video Tag (9)
            Data size: 798
            Timestamp: 783
            Timestamp Extended: 0
            Stream ID: 0
            Data
            Previous tag size: 809
        Audio Tag
            Type: Audio Tag (8)
            Data size: 315
            Timestamp: 809
            Timestamp Extended: 0
            Stream ID: 0
            Data
            Previous tag size: 326
        Video Tag
            Type: Video Tag (9)
            Data size: 11412
            Timestamp: 816
            Timestamp Extended: 0
            Stream ID: 0
            Data
            Previous tag size: 4294180928

No.     Time        Source                Destination           Protocol Length Real Time Messaging Protocol Info
   4133 17.706496   156.35.162.1          192.168.0.98          RTMP     1514   Yes                          Aggregate

Frame 4133: 1514 bytes on wire (12112 bits), 1514 bytes captured (12112 bits)
Ethernet II, Src: Dell_87:49:2e (00:26:b9:87:49:2e), Dst: Dell_aa:08:96 (00:15:c5:aa:08:96)
Internet Protocol Version 4, Src: 156.35.162.1 (156.35.162.1), Dst: 192.168.0.98 (192.168.0.98)
Transmission Control Protocol, Src Port: macromedia-fcs (1935), Dst Port: fjdocdist (1848), Seq: 239824, Ack: 458, Len: 1460
Real Time Messaging Protocol (Aggregate)
    RTMP Header
    RTMP Body
        Audio Tag
            Type: Audio Tag (8)
            Data size: 315
            Timestamp: 835
            Timestamp Extended: 0
            Stream ID: 0
            Data
            Previous tag size: 326
        Video Tag
            Type: Video Tag (9)
            Data size: 638
            Timestamp: 850
            Timestamp Extended: 0
            Stream ID: 0
            Data
            Previous tag size: 649
        Audio Tag
            Type: Audio Tag (8)
            Data size: 315
            Timestamp: 862
            Timestamp Extended: 0
            Stream ID: 0
            Data
            Previous tag size: 326
        Video Tag
            Type: Video Tag (9)
            Data size: 666
            Timestamp: 883
            Timestamp Extended: 0
            Stream ID: 0
            Data
            Previous tag size: 677
        Audio Tag
            Type: Audio Tag (8)
            Data size: 315
            Timestamp: 888
            Timestamp Extended: 0
            Stream ID: 0
            Data
            Previous tag size: 326
        Audio Tag
            Type: Audio Tag (8)
            Data size: 315
            Timestamp: 914
            Timestamp Extended: 0
            Stream ID: 0
            Data
            Previous tag size: 326
        Video Tag
            Type: Video Tag (9)
            Data size: 758
            Timestamp: 917
            Timestamp Extended: 0
            Stream ID: 0
            Data
            Previous tag size: 769
        Audio Tag
            Type: Audio Tag (8)
            Data size: 315
            Timestamp: 940
            Timestamp Extended: 0
            Stream ID: 0
            Data
            Previous tag size: 326
        Video Tag
            Type: Video Tag (9)
            Data size: 1223
            Timestamp: 950
            Timestamp Extended: 0
            Stream ID: 0
            Data
            Previous tag size: 1234
        Audio Tag
            Type: Audio Tag (8)
            Data size: 315
            Timestamp: 966
            Timestamp Extended: 0
            Stream ID: 0
            Data
            Previous tag size: 326
        Video Tag
            Type: Video Tag (9)
            Data size: 690
            Timestamp: 983
            Timestamp Extended: 0
            Stream ID: 0
            Data
            Previous tag size: 701
        Audio Tag
            Type: Audio Tag (8)
            Data size: 315
            Timestamp: 992
            Timestamp Extended: 0
            Stream ID: 0
            Data
            Previous tag size: 326
        Video Tag
            Type: Video Tag (9)
            Data size: 673
            Timestamp: 1017
            Timestamp Extended: 0
            Stream ID: 0
            Data
            Previous tag size: 684
        Audio Tag
            Type: Audio Tag (8)
            Data size: 315
            Timestamp: 1018
            Timestamp Extended: 0
            Stream ID: 0
            Data
            Previous tag size: 326
        Audio Tag
            Type: Audio Tag (8)
            Data size: 315
            Timestamp: 1044
            Timestamp Extended: 0
            Stream ID: 0
            Data
            Previous tag size: 326
        Video Tag
            Type: Video Tag (9)
            Data size: 806
            Timestamp: 1050
            Timestamp Extended: 0
            Stream ID: 0
            Data
            Previous tag size: 817
        Audio Tag
            Type: Audio Tag (8)
            Data size: 315
            Timestamp: 1071
            Timestamp Extended: 0
            Stream ID: 0
            Data
            Previous tag size: 326
        Video Tag
            Type: Video Tag (9)
            Data size: 9446
            Timestamp: 1083
            Timestamp Extended: 0
            Stream ID: 0
            Data
            Previous tag size: 9457
        Audio Tag
            Type: Audio Tag (8)
            Data size: 315
            Timestamp: 1097
            Timestamp Extended: 0
            Stream ID: 0
            Data
            Previous tag size: 326
        Video Tag
            Type: Video Tag (9)
            Data size: 984
            Timestamp: 1117
            Timestamp Extended: 0
            Stream ID: 0
            Data
            Previous tag size: 995
        Audio Tag
            Type: Audio Tag (8)
            Data size: 315
            Timestamp: 1123
            Timestamp Extended: 0
            Stream ID: 0
            Data
            Previous tag size: 326
        Audio Tag
            Type: Audio Tag (8)
            Data size: 315
            Timestamp: 1149
            Timestamp Extended: 0
            Stream ID: 0
            Data
            Previous tag size: 326
        Video Tag
            Type: Video Tag (9)
            Data size: 659
            Timestamp: 1150
            Timestamp Extended: 0
            Stream ID: 0
            Data
            Previous tag size: 670
        Audio Tag
            Type: Audio Tag (8)
            Data size: 315
            Timestamp: 1175
            Timestamp Extended: 0
            Stream ID: 0
            Data
            Previous tag size: 326
        Video Tag
            Type: Video Tag (9)
            Data size: 667
            Timestamp: 1184
            Timestamp Extended: 0
            Stream ID: 0
            Data
            Previous tag size: 678
        Audio Tag
            Type: Audio Tag (8)
            Data size: 315
            Timestamp: 1201
            Timestamp Extended: 0
            Stream ID: 0
            Data
            Previous tag size: 326
        Video Tag
            Type: Video Tag (9)
            Data size: 695
            Timestamp: 1217
            Timestamp Extended: 0
            Stream ID: 0
            Data
            Previous tag size: 706
        Audio Tag
            Type: Audio Tag (8)
            Data size: 315
            Timestamp: 1227
            Timestamp Extended: 0
            Stream ID: 0
            Data
            Previous tag size: 326
        Video Tag
            Type: Video Tag (9)
            Data size: 753
            Timestamp: 1250
            Timestamp Extended: 0
            Stream ID: 0
            Data
            Previous tag size: 764
        Audio Tag
            Type: Audio Tag (8)
            Data size: 315
            Timestamp: 1253
            Timestamp Extended: 0
            Stream ID: 0
            Data
            Previous tag size: 326
        Audio Tag
            Type: Audio Tag (8)
            Data size: 315
            Timestamp: 1280
            Timestamp Extended: 0
            Stream ID: 0
            Data
            Previous tag size: 326
        Video Tag
            Type: Video Tag (9)
            Data size: 760
            Timestamp: 1284
            Timestamp Extended: 0
            Stream ID: 0
            Data
            Previous tag size: 771
        Audio Tag
            Type: Audio Tag (8)
            Data size: 315
            Timestamp: 1306
            Timestamp Extended: 0
            Stream ID: 0
            Data
            Previous tag size: 326
        Video Tag
            Type: Video Tag (9)
            Data size: 830
            Timestamp: 1317
            Timestamp Extended: 0
            Stream ID: 0
            Data
            Previous tag size: 841
        Audio Tag
            Type: Audio Tag (8)
            Data size: 315
            Timestamp: 1332
            Timestamp Extended: 0
            Stream ID: 0
            Data
            Previous tag size: 326
        Video Tag
            Type: Video Tag (9)
            Data size: 7125
            Timestamp: 1350
            Timestamp Extended: 0
            Stream ID: 0
            Data
            Previous tag size: 7136
        Audio Tag
            Type: Audio Tag (8)
            Data size: 315
            Timestamp: 1358
            Timestamp Extended: 0
            Stream ID: 0
            Data
            Previous tag size: 326
        Audio Tag
            Type: Audio Tag (8)
            Data size: 315
            Timestamp: 1384
            Timestamp Extended: 0
            Stream ID: 0
            Data
            Previous tag size: 326
        Video Tag
            Type: Video Tag (9)
            Data size: 1584
            Timestamp: 1384
            Timestamp Extended: 0
            Stream ID: 0
            Data
            Previous tag size: 1595
        Audio Tag
            Type: Audio Tag (8)
            Data size: 315
            Timestamp: 1410
            Timestamp Extended: 0
            Stream ID: 0
            Data
            Previous tag size: 326
        Video Tag
            Type: Video Tag (9)
            Data size: 870
            Timestamp: 1417
            Timestamp Extended: 0
            Stream ID: 0
            Data
            Previous tag size: 881
        Audio Tag
            Type: Audio Tag (8)
            Data size: 315
            Timestamp: 1436
            Timestamp Extended: 0
            Stream ID: 0
            Data
            Previous tag size: 326
        Video Tag
            Type: Video Tag (9)
            Data size: 814
            Timestamp: 1450
            Timestamp Extended: 0
            Stream ID: 0
            Data
            Previous tag size: 825
        Audio Tag
            Type: Audio Tag (8)
            Data size: 315
            Timestamp: 1462
            Timestamp Extended: 0
            Stream ID: 0
            Data
            Previous tag size: 326
        Video Tag
            Type: Video Tag (9)
            Data size: 866
            Timestamp: 1484
            Timestamp Extended: 0
            Stream ID: 0
            Data
            Previous tag size: 877
        Audio Tag
            Type: Audio Tag (8)
            Data size: 315
            Timestamp: 1488
            Timestamp Extended: 0
            Stream ID: 0
            Data
            Previous tag size: 326
        Audio Tag
            Type: Audio Tag (8)
            Data size: 315
            Timestamp: 1515
            Timestamp Extended: 0
            Stream ID: 0
            Data
            Previous tag size: 326
        Video Tag
            Type: Video Tag (9)
            Data size: 968
            Timestamp: 1517
            Timestamp Extended: 0
            Stream ID: 0
            Data
            Previous tag size: 979
        Audio Tag
            Type: Audio Tag (8)
            Data size: 315
            Timestamp: 1541
            Timestamp Extended: 0
            Stream ID: 0
            Data
            Previous tag size: 326
        Video Tag
            Type: Video Tag (9)
            Data size: 1285
            Timestamp: 1551
            Timestamp Extended: 0
            Stream ID: 0
            Data
            Previous tag size: 1296
        Audio Tag
            Type: Audio Tag (8)
            Data size: 315
            Timestamp: 1567
            Timestamp Extended: 0
            Stream ID: 0
            Data
            Previous tag size: 326
        Video Tag
            Type: Video Tag (9)
            Data size: 940
            Timestamp: 1584
            Timestamp Extended: 0
            Stream ID: 0
            Data
            Previous tag size: 951
        Audio Tag
            Type: Audio Tag (8)
            Data size: 315
            Timestamp: 1593
            Timestamp Extended: 0
            Stream ID: 0
            Data
            Previous tag size: 326
        Video Tag
            Type: Video Tag (9)
            Data size: 4924
            Timestamp: 1617
            Timestamp Extended: 0
            Stream ID: 0
            Data
            Previous tag size: 4935
        Audio Tag
            Type: Audio Tag (8)
            Data size: 315
            Timestamp: 1619
            Timestamp Extended: 0
            Stream ID: 0
            Data
            Previous tag size: 326
        Audio Tag
            Type: Audio Tag (8)
            Data size: 315
            Timestamp: 1645
            Timestamp Extended: 0
            Stream ID: 0
            Data
            Previous tag size: 326
        Video Tag
            Type: Video Tag (9)
            Data size: 1194
            Timestamp: 1651
            Timestamp Extended: 0
            Stream ID: 0
            Data
            Previous tag size: 1205
        Audio Tag
            Type: Audio Tag (8)
            Data size: 315
            Timestamp: 1671
            Timestamp Extended: 0
            Stream ID: 0
            Data
            Previous tag size: 326
        Video Tag
            Type: Video Tag (9)
            Data size: 794
            Timestamp: 1684
            Timestamp Extended: 0
            Stream ID: 0
            Data
            Previous tag size: 805
        Audio Tag
            Type: Audio Tag (8)
            Data size: 315
            Timestamp: 1697
            Timestamp Extended: 0
            Stream ID: 0
            Data
            Previous tag size: 326
        Video Tag
            Type: Video Tag (9)
            Data size: 828
            Timestamp: 1717
            Timestamp Extended: 0
            Stream ID: 0
            Data
            Previous tag size: 839
        Audio Tag
            Type: Audio Tag (8)
            Data size: 315
            Timestamp: 1724
            Timestamp Extended: 0
            Stream ID: 0
            Data
            Previous tag size: 326
        Audio Tag
            Type: Audio Tag (8)
            Data size: 315
            Timestamp: 1750
            Timestamp Extended: 0
            Stream ID: 0
            Data
            Previous tag size: 326
        Video Tag
            Type: Video Tag (9)
            Data size: 886
            Timestamp: 1751
            Timestamp Extended: 0
            Stream ID: 0
            Data
            Previous tag size: 897
        Audio Tag
            Type: Audio Tag (8)
            Data size: 315
            Timestamp: 1776
            Timestamp Extended: 0
            Stream ID: 0
            Data
            Previous tag size: 326
        Video Tag
            Type: Video Tag (9)
            Data size: 936
            Timestamp: 1784
            Timestamp Extended: 0
            Stream ID: 0
            Data
            Previous tag size: 947
        Audio Tag
            Type: Audio Tag (8)
            Data size: 315
            Timestamp: 1802
            Timestamp Extended: 0
            Stream ID: 0
            Data
            Previous tag size: 326
        Video Tag
            Type: Video Tag (9)
            Data size: 972
            Timestamp: 1817
            Timestamp Extended: 0
            Stream ID: 0
            Data
            Previous tag size: 983
        Audio Tag
            Type: Audio Tag (8)
            Data size: 315
            Timestamp: 1828
            Timestamp Extended: 0
            Stream ID: 0
            Data
            Previous tag size: 326
        Video Tag
            Type: Video Tag (9)
            Data size: 948
            Timestamp: 1851
            Timestamp Extended: 0
            Stream ID: 0
            Data
            Previous tag size: 959
        Audio Tag
            Type: Audio Tag (8)
            Data size: 315
            Timestamp: 1854
            Timestamp Extended: 0
            Stream ID: 0
            Data
            Previous tag size: 326
        Audio Tag
            Type: Audio Tag (8)
            Data size: 315
            Timestamp: 1880
            Timestamp Extended: 0
            Stream ID: 0
            Data
            Previous tag size: 326
        Video Tag
            Type: Video Tag (9)
            Data size: 7904
            Timestamp: 1884
            Timestamp Extended: 0
            Stream ID: 0
            Data
            Previous tag size: 959071765

No.     Time        Source                Destination           Protocol Length Real Time Messaging Protocol Info
   4213 17.712395   156.35.162.1          192.168.0.98          RTMP     1514   Yes                          Aggregate

Frame 4213: 1514 bytes on wire (12112 bits), 1514 bytes captured (12112 bits)
Ethernet II, Src: Dell_87:49:2e (00:26:b9:87:49:2e), Dst: Dell_aa:08:96 (00:15:c5:aa:08:96)
Internet Protocol Version 4, Src: 156.35.162.1 (156.35.162.1), Dst: 192.168.0.98 (192.168.0.98)
Transmission Control Protocol, Src Port: macromedia-fcs (1935), Dst Port: fjdocdist (1848), Seq: 309739, Ack: 458, Len: 1460
Real Time Messaging Protocol (Aggregate)
    RTMP Header
    RTMP Body
        Audio Tag
            Type: Audio Tag (8)
            Data size: 315
            Timestamp: 1906
            Timestamp Extended: 0
            Stream ID: 0
            Data
            Previous tag size: 326
        Video Tag
            Type: Video Tag (9)
            Data size: 649
            Timestamp: 1918
            Timestamp Extended: 0
            Stream ID: 0
            Data
            Previous tag size: 660
        Audio Tag
            Type: Audio Tag (8)
            Data size: 315
            Timestamp: 1933
            Timestamp Extended: 0
            Stream ID: 0
            Data
            Previous tag size: 326
        Video Tag
            Type: Video Tag (9)
            Data size: 644
            Timestamp: 1951
            Timestamp Extended: 0
            Stream ID: 0
            Data
            Previous tag size: 655
        Audio Tag
            Type: Audio Tag (8)
            Data size: 315
            Timestamp: 1959
            Timestamp Extended: 0
            Stream ID: 0
            Data
            Previous tag size: 326
        Video Tag
            Type: Video Tag (9)
            Data size: 649
            Timestamp: 1984
            Timestamp Extended: 0
            Stream ID: 0
            Data
            Previous tag size: 660
        Audio Tag
            Type: Audio Tag (8)
            Data size: 315
            Timestamp: 1985
            Timestamp Extended: 0
            Stream ID: 0
            Data
            Previous tag size: 326
        Audio Tag
            Type: Audio Tag (8)
            Data size: 315
            Timestamp: 2011
            Timestamp Extended: 0
            Stream ID: 0
            Data
            Previous tag size: 326
        Video Tag
            Type: Video Tag (9)
            Data size: 740
            Timestamp: 2018
            Timestamp Extended: 0
            Stream ID: 0
            Data
            Previous tag size: 751
        Audio Tag
            Type: Audio Tag (8)
            Data size: 315
            Timestamp: 2037
            Timestamp Extended: 0
            Stream ID: 0
            Data
            Previous tag size: 326
        Video Tag
            Type: Video Tag (9)
            Data size: 696
            Timestamp: 2051
            Timestamp Extended: 0
            Stream ID: 0
            Data
            Previous tag size: 707
        Audio Tag
            Type: Audio Tag (8)
            Data size: 315
            Timestamp: 2063
            Timestamp Extended: 0
            Stream ID: 0
            Data
            Previous tag size: 326
        Video Tag
            Type: Video Tag (9)
            Data size: 747
            Timestamp: 2084
            Timestamp Extended: 0
            Stream ID: 0
            Data
            Previous tag size: 758
        Audio Tag
            Type: Audio Tag (8)
            Data size: 315
            Timestamp: 2089
            Timestamp Extended: 0
            Stream ID: 0
            Data
            Previous tag size: 326
        Audio Tag
            Type: Audio Tag (8)
            Data size: 315
            Timestamp: 2115
            Timestamp Extended: 0
            Stream ID: 0
            Data
            Previous tag size: 326
        Video Tag
            Type: Video Tag (9)
            Data size: 813
            Timestamp: 2118
            Timestamp Extended: 0
            Stream ID: 0
            Data
            Previous tag size: 824
        Audio Tag
            Type: Audio Tag (8)
            Data size: 315
            Timestamp: 2142
            Timestamp Extended: 0
            Stream ID: 0
            Data
            Previous tag size: 326
        Video Tag
            Type: Video Tag (9)
            Data size: 8029
            Timestamp: 2151
            Timestamp Extended: 0
            Stream ID: 0
            Data
            Previous tag size: 8040
        Audio Tag
            Type: Audio Tag (8)
            Data size: 315
            Timestamp: 2168
            Timestamp Extended: 0
            Stream ID: 0
            Data
            Previous tag size: 326
        Video Tag
            Type: Video Tag (9)
            Data size: 1399
            Timestamp: 2185
            Timestamp Extended: 0
            Stream ID: 0
            Data
            Previous tag size: 1410
        Audio Tag
            Type: Audio Tag (8)
            Data size: 315
            Timestamp: 2194
            Timestamp Extended: 0
            Stream ID: 0
            Data
            Previous tag size: 326
        Video Tag
            Type: Video Tag (9)
            Data size: 787
            Timestamp: 2218
            Timestamp Extended: 0
            Stream ID: 0
            Data
            Previous tag size: 798
        Audio Tag
            Type: Audio Tag (8)
            Data size: 315
            Timestamp: 2220
            Timestamp Extended: 0
            Stream ID: 0
            Data
            Previous tag size: 326
        Audio Tag
            Type: Audio Tag (8)
            Data size: 315
            Timestamp: 2246
            Timestamp Extended: 0
            Stream ID: 0
            Data
            Previous tag size: 326
        Video Tag
            Type: Video Tag (9)
            Data size: 12837
            Timestamp: 2251
            Timestamp Extended: 0
            Stream ID: 0
            Data
            Previous tag size: 12848
        Audio Tag
            Type: Audio Tag (8)
            Data size: 315
            Timestamp: 2272
            Timestamp Extended: 0
            Stream ID: 0
            Data
            Previous tag size: 326
        Video Tag
            Type: Video Tag (9)
            Data size: 2644
            Timestamp: 2285
            Timestamp Extended: 0
            Stream ID: 0
            Data
            Previous tag size: 2655
        Audio Tag
            Type: Audio Tag (8)
            Data size: 315
            Timestamp: 2298
            Timestamp Extended: 0
            Stream ID: 0
            Data
            Previous tag size: 326
        Video Tag
            Type: Video Tag (9)
            Data size: 1317
            Timestamp: 2318
            Timestamp Extended: 0
            Stream ID: 0
            Data
            Previous tag size: 1328
        Audio Tag
            Type: Audio Tag (8)
            Data size: 315
            Timestamp: 2324
            Timestamp Extended: 0
            Stream ID: 0
            Data
            Previous tag size: 326
        Audio Tag
            Type: Audio Tag (8)
            Data size: 315
            Timestamp: 2351
            Timestamp Extended: 0
            Stream ID: 0
            Data
            Previous tag size: 326
        Video Tag
            Type: Video Tag (9)
            Data size: 1245
            Timestamp: 2351
            Timestamp Extended: 0
            Stream ID: 0
            Data
            Previous tag size: 1256
        Audio Tag
            Type: Audio Tag (8)
            Data size: 315
            Timestamp: 2377
            Timestamp Extended: 0
            Stream ID: 0
            Data
            Previous tag size: 326
        Video Tag
            Type: Video Tag (9)
            Data size: 1500
            Timestamp: 2385
            Timestamp Extended: 0
            Stream ID: 0
            Data
            Previous tag size: 1511
        Audio Tag
            Type: Audio Tag (8)
            Data size: 315
            Timestamp: 2403
            Timestamp Extended: 0
            Stream ID: 0
            Data
            Previous tag size: 326
        Video Tag
            Type: Video Tag (9)
            Data size: 1670
            Timestamp: 2418
            Timestamp Extended: 0
            Stream ID: 0
            Data
            Previous tag size: 1681
        Audio Tag
            Type: Audio Tag (8)
            Data size: 315
            Timestamp: 2429
            Timestamp Extended: 0
            Stream ID: 0
            Data
            Previous tag size: 326
        Video Tag
            Type: Video Tag (9)
            Data size: 1465
            Timestamp: 2451
            Timestamp Extended: 0
            Stream ID: 0
            Data
            Previous tag size: 1476
        Audio Tag
            Type: Audio Tag (8)
            Data size: 315
            Timestamp: 2455
            Timestamp Extended: 0
            Stream ID: 0
            Data
            Previous tag size: 326
        Audio Tag
            Type: Audio Tag (8)
            Data size: 315
            Timestamp: 2481
            Timestamp Extended: 0
            Stream ID: 0
            Data
            Previous tag size: 326
        Video Tag
            Type: Video Tag (9)
            Data size: 1641
            Timestamp: 2485
            Timestamp Extended: 0
            Stream ID: 0
            Data
            Previous tag size: 1652
        Audio Tag
            Type: Audio Tag (8)
            Data size: 315
            Timestamp: 2507
            Timestamp Extended: 0
            Stream ID: 0
            Data
            Previous tag size: 326
        Video Tag
            Type: Video Tag (9)
            Data size: 4661
            Timestamp: 2518
            Timestamp Extended: 0
            Stream ID: 0
            Data
            Previous tag size: 4672
        Audio Tag
            Type: Audio Tag (8)
            Data size: 315
            Timestamp: 2533
            Timestamp Extended: 0
            Stream ID: 0
            Data
            Previous tag size: 326
        Video Tag
            Type: Video Tag (9)
            Data size: 527
            Timestamp: 2552
            Timestamp Extended: 0
            Stream ID: 0
            Data
            Previous tag size: 538
        Audio Tag
            Type: Audio Tag (8)
            Data size: 315
            Timestamp: 2560
            Timestamp Extended: 0
            Stream ID: 0
            Data
            Previous tag size: 326
        Video Tag
            Type: Video Tag (9)
            Data size: 573
            Timestamp: 2585
            Timestamp Extended: 0
            Stream ID: 0
            Data
            Previous tag size: 584
        Audio Tag
            Type: Audio Tag (8)
            Data size: 315
            Timestamp: 2586
            Timestamp Extended: 0
            Stream ID: 0
            Data
            Previous tag size: 326
        Audio Tag
            Type: Audio Tag (8)
            Data size: 315
            Timestamp: 2612
            Timestamp Extended: 0
            Stream ID: 0
            Data
            Previous tag size: 326
        Video Tag
            Type: Video Tag (9)
            Data size: 685
            Timestamp: 2618
            Timestamp Extended: 0
            Stream ID: 0
            Data
            Previous tag size: 696
        Audio Tag
            Type: Audio Tag (8)
            Data size: 315
            Timestamp: 2638
            Timestamp Extended: 0
            Stream ID: 0
            Data
            Previous tag size: 326
        Video Tag
            Type: Video Tag (9)
            Data size: 679
            Timestamp: 2652
            Timestamp Extended: 0
            Stream ID: 0
            Data
            Previous tag size: 690
        Audio Tag
            Type: Audio Tag (8)
            Data size: 315
            Timestamp: 2664
            Timestamp Extended: 0
            Stream ID: 0
            Data
            Previous tag size: 326
        Video Tag
            Type: Video Tag (9)
            Data size: 699
            Timestamp: 2685
            Timestamp Extended: 0
            Stream ID: 0
            Data
            Previous tag size: 710
        Audio Tag
